{
  "admission": {
    "decision": "not_reproduced",
    "failure_classification": "baseline_not_reproduced",
    "verified": false
  },
  "baseline": {
    "duration_sec": 14.043974000000162,
    "fail_to_pass_passed": 1,
    "fail_to_pass_total": 1,
    "mode": "baseline",
    "pass_to_pass_passed": 1,
    "pass_to_pass_total": 1,
    "status": "baseline_not_reproduced",
    "task_id": "pytorch__127190__lr_scheduler_deepcopy"
  },
  "created_at": "2026-06-20T17:10:13Z",
  "environment": {
    "backend": "docker",
    "digest_kind": "local_image_id",
    "id": "pytorch-cpu-torch2.6.0-py311",
    "image": "op-bench/pytorch-cpu:torch2.6.0-py311",
    "image_digest": "sha256:9507757065fd73fa7a958cd13f01de163a3fa46d826c09142f9522eda0f1e400",
    "platform": null,
    "runtime_tier": "cpu_python_overlay"
  },
  "evidence_id": "pytorch__127190__lr_scheduler_deepcopy:cf13251f8903:2026-06-20T17:10:13Z",
  "gold": null,
  "schema_version": "v1",
  "source": {
    "base_commit": "d8d0bf264a736c7fb3cd17799a1c1aba4addf8d9",
    "id": "pytorch-d8d0bf2-python-overlay",
    "repo_url": "https://github.com/pytorch/pytorch.git",
    "snapshot_hash": null,
    "snapshot_method": null
  },
  "task_id": "pytorch__127190__lr_scheduler_deepcopy",
  "task_manifest_hash": "sha256:cf13251f890323c87dafe7cd4eedbe7c49feeb55e1ad9be1f7f4e46bf700f0cb"
}
